{
  "version": 1,
  "run_id": "synthetic-run",
  "started_at": "2026-01-01T12:00:00Z",
  "completed_at": "2026-01-01T12:00:01Z",
  "identity": {
    "repository": "example/project",
    "head": "1111111111111111111111111111111111111111",
    "base": "2222222222222222222222222222222222222222",
    "tree": "",
    "mode": "merge",
    "executor": "act",
    "platform": "linux/amd64",
    "fingerprints": {
      "workflow": "",
      "config": "",
      "policy": "",
      "dependencies": "",
      "toolchain": "",
      "environment": ""
    }
  },
  "input": "conflict",
  "checks": [
    {
      "id": "ci.yml/test",
      "required": true,
      "needs": []
    }
  ],
  "results": []
}
